{
  "caso_id": "BR-brasil-participativo-clustering-semantic",
  "pais": "BR",
  "nombre_caso": "Brasil Participativo - Clasificador Automático de Propuestas (NLP/ML)",
  "ano_inicio": null,
  "ano_cierre": null,
  "estado_actividad": "desconocido",
  "organizacion_a_cargo": "Secretaria de Participação Social / ResidenciaTICBrisa",
  "tipo_convocante": ["gobierno nacional"],
  "tipo_organizacion": ["Público"],
  "tipo_desarrollador_IA": ["Academia"],
  "origen_desarrollador": "Nacional",
  "metodologia_participacion": "Brasil Participativo es la plataforma digital del gobierno federal brasileño (basada en software libre Decidim) donde la ciudadanía puede contribuir con propuestas para la creación y mejora de políticas públicas. El proyecto de clasificación busca aplicar procesamiento de lenguaje natural (PLN) para indexar y categorizar automáticamente las propuestas ciudadanas. Desarrollado por estudiantes del programa ResidenciaTICBrisa con mentoría de la Secretaria de Participação Social.",
  "tipo_proceso": ["Gobernanza Colaborativa"],
  "etapas_uso_IA": ["Análisis"],
  "familia_IA": ["NLP", "Clustering"],
  "usa_LLM_generativa": "no-claro",
  "funcion_IA": "El sistema aplica procesamiento de lenguaje natural (PLN) y machine learning para categorizar de forma automatizada las propuestas ciudadanas publicadas en Brasil Participativo. Utiliza Apache Airflow para el entrenamiento diario del modelo con datos actualizados de la plataforma.",
  "rol_IA": "contenido",
  "continuidad": ["Plataforma"],
  "nivel_consolidacion": 1,
  "estado_implementacion": 0.25,
  "usa_IA_en_proceso": "sí",
  "tipo_pogrebinschi": "Participação Digital",
  "model_version": "(definir-en-corrida)",
  "fecha_extraccion": "2026-06-05",
  "pasada": "B",
  "evidencia_verbatim": {
    "pais": "Brasil Participativo é a nova plataforma digital do governo federal",
    "tipo_proceso": "a população possa contribuir com a criação e melhoria das políticas públicas",
    "etapas_uso_IA": "A ideia da proposta é fazer análise das propostas por meio de processamento de linguagem natural (PLN)",
    "estado_actividad": null,
    "nivel_consolidacion": "O Apache e responsavel pela atualização e o treinamento diario do modelo em conjunto com os dados da plataforma do brasil participativo",
    "tipo_convocante": "Mentores: Laila, Secretaria de Participação Social",
    "usa_IA_en_proceso": "a plataforma não possui indexação ou processamento de linguagem natural para categorizar de forma automatizada as propostas",
    "rol_IA": "fazer análise das propostas por meio de processamento de linguagem natural (PLN)"
  },
  "urls_fuente": ["https://github.com/ResidenciaTICBrisa/BP-Classificador-de-Propostas"],
  "alertas": [
    "estado_actividad: no hay fecha; se desconoce si el clasificador fue integrado a la plataforma o quedó como prototipo académico",
    "nivel_consolidacion fijado en 1 (prototipo): el texto describe el desarrollo y la intención de integración, sin evidencia de uso real en producción",
    "usa_LLM_generativa: no-claro; NLP/ML clásico (scikit-learn), sin LLM generativa",
    "El caso_id menciona 'BERTopic+LLM' pero el texto fetcheado no lo confirma (scikit-learn, NLTK = NLP clásico)",
    "tipo_convocante: la Secretaria de Participação Social aparece como mentora del proyecto académico, no como convocante directo; se mantiene 'gobierno nacional' con cautela",
    "fuente única: toda la extracción se basa en la FUENTE 3 (GitHub); FUENTES 1-2 con ERROR 403"
  ]
}
