{
  "caso_id": "CL-el-chile-que-queremos-ecqq-minciencia",
  "pais": null,
  "nombre_caso": "El Chile que Queremos (ECQQ) - MinCiencia",
  "ano_inicio": null,
  "ano_cierre": null,
  "estado_actividad": "desconocido",
  "organizacion_a_cargo": "MinCiencia",
  "tipo_convocante": [],
  "tipo_organizacion": [],
  "tipo_desarrollador_IA": ["Gobierno"],
  "origen_desarrollador": null,
  "metodologia_participacion": "El repositorio contiene código para procesamiento de datos de contribuciones ciudadanas (Consultas individuales y Diálogos), clasificación de contribuciones mediante redes neuronales y árboles de decisión, análisis de emociones y necesidades mediante NLP, y visualización mediante dashboards. No se describe explícitamente el mecanismo de recolección de aportes ni la plataforma de participación.",
  "tipo_proceso": [],
  "etapas_uso_IA": ["Análisis"],
  "familia_IA": ["NLP", "Clustering", "Otros(redes neuronales - RNN)", "Otros(árboles de decisión - Random Forest)"],
  "usa_LLM_generativa": "no",
  "funcion_IA": "La IA clasifica contribuciones ciudadanas mediante redes neuronales (RNN) y árboles de decisión (Random Forest), sistematiza emociones y necesidades mediante análisis de tópicos con NLP.",
  "rol_IA": "contenido",
  "continuidad": [],
  "nivel_consolidacion": 2,
  "estado_implementacion": 0.75,
  "usa_IA_en_proceso": "sí",
  "tipo_pogrebinschi": null,
  "model_version": "(definir-en-corrida)",
  "fecha_extraccion": "2026-06-05",
  "pasada": "A",
  "evidencia_verbatim": {
    "pais": null,
    "tipo_proceso": null,
    "etapas_uso_IA": "Este repositorio contiene los procedimientos para realizar la clasificación de las contribuciones con redes neuronales",
    "estado_actividad": null,
    "nivel_consolidacion": "En este repositorio se pueden encontrar",
    "tipo_convocante": "MinCiencia",
    "usa_IA_en_proceso": "clasificación de las contribuciones con árboles de decisión",
    "rol_IA": "Grouping Emotions.ipynb que sirve para sistematizar las Emociones"
  },
  "urls_fuente": ["https://github.com/MinCiencia/ECQQ"],
  "alertas": [
    "pais: no hay cita textual que mencione 'Chile' o código de país en el texto fetcheado (solo el nombre del repo); país=null por no inferir",
    "tipo_convocante: el texto solo menciona 'MinCiencia' como cuenta de GitHub, sin describir su rol como convocante del proceso",
    "tipo_proceso: el texto describe código de análisis posterior pero no el proceso participativo en sí; sin cita suficiente",
    "estado_actividad/ano: no hay fechas ni indicadores en el texto fetcheado",
    "nivel_consolidacion: nivel 2 inferido de la presencia de código ejecutado, pero la cita no sustenta recurrencia; fuente única (GitHub)",
    "fuente única: solo el README del repositorio; falta fuente institucional del proceso"
  ]
}
