{
  "caso_id": "CL-el-chile-que-queremos-ecqq-minciencia",
  "pais": null,
  "nombre_caso": "El Chile que Queremos (ECQQ) - MinCiencia",
  "ano_inicio": null,
  "ano_cierre": null,
  "estado_actividad": "desconocido",
  "organizacion_a_cargo": null,
  "tipo_convocante": [],
  "tipo_organizacion": [],
  "tipo_desarrollador_IA": [],
  "origen_desarrollador": null,
  "metodologia_participacion": "El repositorio contiene herramientas de procesamiento y clasificación de datos de contribuciones ciudadanas (Consultas individuales y Diálogos), con categorías de Emociones, Necesidades y Propuestas. No se describe el proceso participativo original ni cómo se recolectaron las contribuciones.",
  "tipo_proceso": [],
  "etapas_uso_IA": [],
  "familia_IA": [],
  "usa_LLM_generativa": "no-claro",
  "funcion_IA": null,
  "rol_IA": "no-claro",
  "continuidad": [],
  "nivel_consolidacion": 0,
  "estado_implementacion": 0.25,
  "usa_IA_en_proceso": "no-claro",
  "tipo_pogrebinschi": null,
  "model_version": "(definir-en-corrida)",
  "fecha_extraccion": "2026-06-05",
  "pasada": "B",
  "evidencia_verbatim": {
    "pais": null,
    "tipo_proceso": null,
    "etapas_uso_IA": null,
    "estado_actividad": null,
    "nivel_consolidacion": null,
    "tipo_convocante": null,
    "usa_IA_en_proceso": null,
    "rol_IA": null
  },
  "urls_fuente": ["https://github.com/MinCiencia/ECQQ"],
  "alertas": [
    "ALERTA_PAIS: el texto no contiene cita explícita de 'Chile'/'CL'; el nombre del repo lo sugiere pero no se infiere. pais=null",
    "ALERTA_CONVOCANTE: solo aparece la cuenta GitHub 'MinCiencia'; no hay texto sobre quién convoca/dirige el proceso. organizacion_a_cargo=null",
    "ALERTA_PROCESO: el texto describe solo un repositorio de código y datos; no describe el proceso participativo (convocatoria, participantes, fecha, mecanismo)",
    "ALERTA_ROL_IA: hay clasificación de contribuciones con redes neuronales y árboles de decisión, pero sin evidencia de integración a un proceso participativo activo; se mantiene 'no-claro'",
    "ALERTA_NIVEL: sin fechas ni recurrencia, nivel_consolidacion=0 por ausencia de evidencia",
    "candidato_a_revision: si existe documentación del proceso 'El Chile que Queremos', podría recalificarse. Fuente recomendada: sitio oficial del Ministerio de Ciencia de Chile",
    "fuente única (GitHub README); sin fuente secundaria"
  ]
}
